{
  "id": "warehouse",
  "name": "Warehouse bay",
  "description": "Pallet, stacked crate, open crate, sacks, and two barrels.",
  "tags": ["warehouse", "shipping", "storage"],
  "items": [
    { "recipe": "pallet", "location": [0, 0, 0] },
    { "recipe": "crate", "location": [0, 0, 0.14] },
    { "recipe": "crate_open", "location": [1.6, 0.1, 0] },
    { "recipe": "sack", "location": [1.55, -0.45, 0.04] },
    { "recipe": "sack", "location": [1.85, -0.35, 0.04] },
    { "recipe": "barrel", "location": [-1.5, 0.2, 0] },
    { "recipe": "barrel", "location": [-2.2, 0.2, 0] },
    { "recipe": "crate_battens", "location": [-1.8, 1.1, 0] }
  ]
}
