{
  "id": "market",
  "name": "Market stall",
  "description": "Table stall with open crate, sacks, bucket, and a lantern.",
  "tags": ["market", "outdoor", "shipping"],
  "items": [
    { "recipe": "table", "location": [0, 0, 0] },
    { "recipe": "crate_open", "location": [0.15, 0.05, 0.76] },
    { "recipe": "sack", "location": [-0.55, 0.15, 0.76] },
    { "recipe": "sack", "location": [-0.75, -0.1, 0] },
    { "recipe": "bucket", "location": [0.85, -0.35, 0] },
    { "recipe": "lantern", "location": [1.15, 0.2, 0] },
    { "recipe": "crate", "location": [-1.4, 0.1, 0] }
  ]
}
