{
  "id": "crate_stack",
  "name": "Crate stack",
  "description": "Pallet with three stacked crates, plus an open crate and a batten crate.",
  "tags": ["shipping", "storage", "stack"],
  "items": [
    { "recipe": "pallet", "location": [0, 0, 0] },
    {
      "recipe": "crate",
      "location": [0, 0, 0.14],
      "repeat": 3,
      "offset": [0, 0, 0.51]
    },
    { "recipe": "crate_open", "location": [1.15, 0.05, 0] },
    { "recipe": "crate_battens", "location": [-1.15, 0.05, 0] }
  ]
}
